{
  "$id": "https://kohaku-ui.dev/schemas/0.1/policy.schema.json",
  "title": "kohaku Policy file",
  "description": "Declarative Policy-as-Code file (design.md #69): default and per-tenant ComposePolicy/rate-limit/RBAC overrides, loaded by host-core's createPolicyRuntime. Fields that are functions in ComposePolicy (routeTier, fewShot, designSystem, fixedSpecs, l2Smoke, selectComponents, extraRules) cannot be expressed in JSON and are intentionally absent -- they remain the base ComposePolicy supplied by product code.",
  "$schema": "https://json-schema.org/draft/2020-12/schema",
  "type": "object",
  "properties": {
    "$schema": {
      "type": "string"
    },
    "version": {
      "type": "number",
      "const": 1
    },
    "label": {
      "type": "string"
    },
    "defaults": {
      "type": "object",
      "properties": {
        "compose": {
          "type": "object",
          "properties": {
            "allowL2": {
              "type": "boolean"
            },
            "maxRepairAttempts": {
              "type": "integer",
              "minimum": 0,
              "maximum": 9007199254740991
            },
            "refConstraint": {
              "type": "string",
              "enum": [
                "schema",
                "validate"
              ]
            },
            "effort": {
              "type": "object",
              "properties": {
                "l1": {
                  "type": "string",
                  "enum": [
                    "low",
                    "medium",
                    "high",
                    "xhigh",
                    "max"
                  ]
                },
                "l2": {
                  "type": "string",
                  "enum": [
                    "low",
                    "medium",
                    "high",
                    "xhigh",
                    "max"
                  ]
                }
              },
              "additionalProperties": false
            },
            "outputLanguage": {
              "type": "string"
            },
            "cacheFailure": {
              "type": "string",
              "enum": [
                "open",
                "closed"
              ]
            },
            "ttlSeconds": {
              "type": "integer",
              "minimum": 0,
              "maximum": 9007199254740991
            },
            "budget": {
              "type": "object",
              "properties": {
                "perCompose": {
                  "type": "object",
                  "properties": {
                    "stopAfterTokens": {
                      "type": "integer",
                      "minimum": 0,
                      "maximum": 9007199254740991
                    }
                  },
                  "required": [
                    "stopAfterTokens"
                  ],
                  "additionalProperties": false
                },
                "deadlineMs": {
                  "type": "integer",
                  "exclusiveMinimum": 0,
                  "maximum": 9007199254740991
                },
                "dailyTokens": {
                  "type": "integer",
                  "minimum": 0,
                  "maximum": 9007199254740991
                }
              },
              "additionalProperties": false
            }
          },
          "additionalProperties": false
        },
        "rateLimits": {
          "type": "object",
          "properties": {
            "compose": {
              "type": "object",
              "properties": {
                "capacity": {
                  "type": "integer",
                  "exclusiveMinimum": 0,
                  "maximum": 9007199254740991
                },
                "refillPerSecond": {
                  "type": "number",
                  "exclusiveMinimum": 0
                }
              },
              "required": [
                "capacity",
                "refillPerSecond"
              ],
              "additionalProperties": false
            },
            "action": {
              "type": "object",
              "properties": {
                "capacity": {
                  "type": "integer",
                  "exclusiveMinimum": 0,
                  "maximum": 9007199254740991
                },
                "refillPerSecond": {
                  "type": "number",
                  "exclusiveMinimum": 0
                }
              },
              "required": [
                "capacity",
                "refillPerSecond"
              ],
              "additionalProperties": false
            },
            "resolve": {
              "type": "object",
              "properties": {
                "capacity": {
                  "type": "integer",
                  "exclusiveMinimum": 0,
                  "maximum": 9007199254740991
                },
                "refillPerSecond": {
                  "type": "number",
                  "exclusiveMinimum": 0
                }
              },
              "required": [
                "capacity",
                "refillPerSecond"
              ],
              "additionalProperties": false
            }
          },
          "additionalProperties": false
        },
        "governance": {
          "type": "object",
          "properties": {
            "roles": {
              "type": "object",
              "propertyNames": {
                "type": "string"
              },
              "additionalProperties": {
                "type": "array",
                "items": {
                  "type": "string"
                }
              }
            }
          },
          "required": [
            "roles"
          ],
          "additionalProperties": false
        }
      },
      "additionalProperties": false
    },
    "tenants": {
      "type": "object",
      "propertyNames": {
        "type": "string"
      },
      "additionalProperties": {
        "type": "object",
        "properties": {
          "compose": {
            "type": "object",
            "properties": {
              "allowL2": {
                "type": "boolean"
              },
              "maxRepairAttempts": {
                "type": "integer",
                "minimum": 0,
                "maximum": 9007199254740991
              },
              "refConstraint": {
                "type": "string",
                "enum": [
                  "schema",
                  "validate"
                ]
              },
              "effort": {
                "type": "object",
                "properties": {
                  "l1": {
                    "type": "string",
                    "enum": [
                      "low",
                      "medium",
                      "high",
                      "xhigh",
                      "max"
                    ]
                  },
                  "l2": {
                    "type": "string",
                    "enum": [
                      "low",
                      "medium",
                      "high",
                      "xhigh",
                      "max"
                    ]
                  }
                },
                "additionalProperties": false
              },
              "outputLanguage": {
                "type": "string"
              },
              "cacheFailure": {
                "type": "string",
                "enum": [
                  "open",
                  "closed"
                ]
              },
              "ttlSeconds": {
                "type": "integer",
                "minimum": 0,
                "maximum": 9007199254740991
              },
              "budget": {
                "type": "object",
                "properties": {
                  "perCompose": {
                    "type": "object",
                    "properties": {
                      "stopAfterTokens": {
                        "type": "integer",
                        "minimum": 0,
                        "maximum": 9007199254740991
                      }
                    },
                    "required": [
                      "stopAfterTokens"
                    ],
                    "additionalProperties": false
                  },
                  "deadlineMs": {
                    "type": "integer",
                    "exclusiveMinimum": 0,
                    "maximum": 9007199254740991
                  },
                  "dailyTokens": {
                    "type": "integer",
                    "minimum": 0,
                    "maximum": 9007199254740991
                  }
                },
                "additionalProperties": false
              }
            },
            "additionalProperties": false
          },
          "rateLimits": {
            "type": "object",
            "properties": {
              "compose": {
                "type": "object",
                "properties": {
                  "capacity": {
                    "type": "integer",
                    "exclusiveMinimum": 0,
                    "maximum": 9007199254740991
                  },
                  "refillPerSecond": {
                    "type": "number",
                    "exclusiveMinimum": 0
                  }
                },
                "required": [
                  "capacity",
                  "refillPerSecond"
                ],
                "additionalProperties": false
              },
              "action": {
                "type": "object",
                "properties": {
                  "capacity": {
                    "type": "integer",
                    "exclusiveMinimum": 0,
                    "maximum": 9007199254740991
                  },
                  "refillPerSecond": {
                    "type": "number",
                    "exclusiveMinimum": 0
                  }
                },
                "required": [
                  "capacity",
                  "refillPerSecond"
                ],
                "additionalProperties": false
              },
              "resolve": {
                "type": "object",
                "properties": {
                  "capacity": {
                    "type": "integer",
                    "exclusiveMinimum": 0,
                    "maximum": 9007199254740991
                  },
                  "refillPerSecond": {
                    "type": "number",
                    "exclusiveMinimum": 0
                  }
                },
                "required": [
                  "capacity",
                  "refillPerSecond"
                ],
                "additionalProperties": false
              }
            },
            "additionalProperties": false
          },
          "governance": {
            "type": "object",
            "properties": {
              "roles": {
                "type": "object",
                "propertyNames": {
                  "type": "string"
                },
                "additionalProperties": {
                  "type": "array",
                  "items": {
                    "type": "string"
                  }
                }
              }
            },
            "required": [
              "roles"
            ],
            "additionalProperties": false
          }
        },
        "additionalProperties": false
      }
    }
  },
  "required": [
    "version",
    "defaults"
  ],
  "additionalProperties": false
}
